query,title,url,description,contact_number,Company board members,screenshot
scholarship in canada,Bachelor's & Master's Degrees - Official Website,https://www.suu.edu/online/,Our 100% online degrees are designed to provide the flexibility & affordability you need.,not found,not found,media/data/scholarship in canada/scholarship in canada_17.png
scholarship in canada,Full Scholarship In Canada - Full Scholarship In Canada,https://search.visymo.com/ws?q=full%20scholarship%20in%20canada&asid=vis_au_sg_05&mt=b&nw=g&de=c&ap=,Search for Full Scholarship In Canada. Get the Best Results for Full Scholarship In Canada.,not found,not found,media/data/scholarship in canada/scholarship in canada_18.png
scholarship in canada,Current Scholarships 2023-2024 - Full Funded Scholarship...,https://global-scholarship.shoptorsi.com/,Study In Canada USA UK; Universities with International Scholarship 2023-24: Apply online,2147483647,"['Our Partners', 'Global Academy', 'Holistic Leadership']",media/data/scholarship in canada/scholarship in canada_19.png
scholarship in canada,Scholarship Programs Available - Apply For A Scholarship Today,https://catchabreakscholar.org/how-to-apply/,"We Select Scholarship Recipients Each Year And Provide Up To $11,000 Per Year. Read More! We Believe In The Value Of A College Experience And The Rewards Of A...",9999999999,['Word From'],media/data/scholarship in canada/scholarship in canada_20.png
scholarship in canada,Scholarships Available - Apply Now,https://iseusa.org/travel-study-abroad/high-school-study-abroad/,"Experience the academic, career, and personal benefits of studying abroad in high school.",not found,not found,media/data/scholarship in canada/scholarship in canada_21.png
scholarship in canada,Canada University Scholarship - Scholarships 2023,https://rcaffoundation.ca/portfolio-items/2023-student-scholarship-recipients/,Funding opportunity for students with future careers in aviation and aerospace industries,9999999999,[],media/data/scholarship in canada/scholarship in canada_22.png
scholarship in canada,See Scholarship Requirements - Apply For Scholarships,https://nasf.org/education/scholarships/,"NASF Scholarships Are Open To College Juniors, Seniors, As Well As Graduate Students.",not found,not found,media/data/scholarship in canada/scholarship in canada_23.png
scholarship in canada,5 Scholarships Available - Applications Are Now Open,https://www.sya.org/admissions/affording-sya/scholarships-financial-aid,Our Scholarships Help Provide Students With An Excellent Academic Experience. Learn More!,not found,not found,media/data/scholarship in canada/scholarship in canada_25.png
scholarship in canada,Scholarships To Apply To - Scholarship Opportunities,https://getschooled.com/journey/get-to-college/scholarships-for-college/,Let Get Schooled help you achieve your goals. We'll find scholarships best suited for you,not found,not found,media/data/scholarship in canada/scholarship in canada_26.png
scholarship in canada,Study in Canada & Scholarship - Canada Study 2023 Apply ASAP,https://goreto.edu.np/,Canada has revised Study Permit Application Policy Get updated guidance with Goreto Member,not found,not found,media/data/scholarship in canada/scholarship in canada_34.png
scholarship in canada,View The Scholarships We Offer - Explore Open Opportunities,https://www.aises.org/students/scholarships,AISES Offers A Variety Of Scholarship Opportunities For Undergraduate & Graduate Students.,not found,not found,media/data/scholarship in canada/scholarship in canada_39.png
scholarship in canada,Full Scholarship In Canada - Now,https://www.discovertoday.co/ar?q=full%20scholarship%20in%20canada,Find Full Scholarship In Canada. Now with us! Search For Full Scholarship In Canada at Discovertoday.co. Ergebnisse 24/7. Suchergebnisse. Attraktive Ergebnisse. Über 100.000 Ergebnisse. Spezialist Suchen. Immer verfügbar 24/7. Sofortige Antwort.,not found,not found,media/data/scholarship in canada/scholarship in canada_44.png
scholarship in canada,Historic college scholarship - Enroll today and learn more,https://www.battlecreekpublicschools.org/bearcatadvantage,Covering up to 100% of college tuition and fees through the Bearcat Advantage scholarship.,not found,not found,media/data/scholarship in canada/scholarship in canada_46.png
scholarship in canada,Find Scholarships Here - Apply For Scholarships Online,https://www.hillel.org/jewish-scholarships-portal/,Our Scholarship Portal Is Your One-Stop Shop For Hundreds Of Scholarships. Browse Today!,not found,not found,media/data/scholarship in canada/scholarship in canada_55.png
scholarship in canada,Scholarships Available - Apply For A Scholarship,https://www.kaileemillsfoundation.org/scholarships/,Encouraging Everyone to Buckle Up. Apply For Our Kailee Mills Foundation Scholarships.,not found,not found,media/data/scholarship in canada/scholarship in canada_57.png
scholarship in canada,Scholarship Opportunities - Eligibility & Requirements,https://thisispublichealth.aspph.org/financing-your-degree/,Tips for obtaining a scholarship and resources for prospective students of public health,not found,not found,media/data/scholarship in canada/scholarship in canada_70.png
plumber in sydney,Local Plumbers 24 Hours Sydney - Speedy Plumbers Nearby...,https://www.progeneralplumbing.com.au/,Need A Plumber Today? 24 Hour Speedy Plumbing Services. Competitive Prices. Call Us,not found,not found,media/data/plumber in sydney/plumber in sydney_3.png
scholarships in australia,Business School Australia - Master Hospitality Management,https://www.cordonbleu.edu/australia/masters-degrees/en,Take your career to the next level with a Master's degree from Le Cordon Bleu Australia.,888-289-6302,"['Great Vibes', 'Open Source', 'Windows Phone', 'Helvetica Neue', 'Noto Sans', 'Address Firefox', 'Noto Sans', 'Noto Sans', 'Noto Sans', 'Noto Sans', 'Noto Sans', 'Noto Sans', 'Noto Sans', 'Noto Sans']",media/data/scholarships in australia/scholarships in australia_6.png
plumber in sydney,Sydney Plumber - Available 24/7,https://optimisedplumbingservices.com.au/plumbing-services/sydney-plumber/,"Using the latest technology, our fully licensed plumbers will unblock your drain fast. We'll...",not found,not found,media/data/plumber in sydney/plumber in sydney_3.png
plumber in sydney,Strata Plumbing Sydney,https://optimisedplumbingservices.com.au/plumbing-services/strata-plumbing-sydney/,"Our friendly, reliable team have the experience and knowledge to fix your blocked drain. Same-Day Service Or It's Free, With Honest & Upfront Pricing. Local Plumber. 24/7 Plumber.",not found,not found,media/data/plumber in sydney/plumber in sydney_4.png
electrician in australia,Electrical Contractor Services - Residential Electrician,https://electricianmelbourne-maes.com.au/,Quality Electrical Services by Years of Experience. industrial electricians’ contractors. Electrical contractors. Residential Electrical Contractors. Call Us for free quote!,not found,not found,media/data/electrician in australia/electrician in australia_0.png
electrician in australia,Electrical Repair & Install - Electrical Maintenance Service,https://www.highgroundelectrical.com.au/,Skilled Australian Electricians fully qualified for all Industrial Electric Jobs. Call us.,not found,not found,media/data/electrician in australia/electrician in australia_1.png
electrician in australia,Electrical Contractor - Trusted Electrical Solutions,https://jenelectrical.com.au/,"At JEN Electrical Our Team Is Highly Qualified & Friendly, For All Your Commercial Needs.",not found,not found,media/data/electrician in australia/electrician in australia_2.png
electrician in australia,Brisbane Electrician - Professional Electrician,https://moranpowersolutions.com.au/brisbane-electrician-promo/,Brisbane's #1 Choice For Electrical Services. Over 17 Years Electrical Experience. 100...,not found,not found,media/data/electrician in australia/electrician in australia_3.png
electrician in australia,Melbourne Electricians - Reliable Electrical Companies,https://www.nationalon.com.au/melbourne/electrical-services/?utm_source=google+&utm_medium=cpc&utm_campaign=nonmadcampaignjune2023&utm_id=nonmadcampaignjune2023,"Experts in electrical, communications, maintenance and design for commercial spaces. For a Trusted Electrical Company with 40+ years experience. Contact us today!",not found,not found,media/data/electrician in australia/electrician in australia_1.png
electrician in sydney,Local Electricians Sydney - Find top electrician in Sydney,https://hqservices.com.au/electrical-services/,"Cheap deals for all types of electrical services by licensed-expert electricians in Sydney. Safety-inspection, lighting-wiring, heating, powerpoint, ceiling fan, smart homes services.",not found,not found,not found,not found,media/data/electrician in sydney/electrician in sydney_0.png
electrician in sydney,Electrician Jobs in Sydney NSW (with Salaries) 2023,https://au.indeed.com/m/jobs?q=electrician&aceid=&l=sydney+nsw,Start Your Search For Great Jobs At Indeed With Thousands Of Jobs Online Today.,not found,not found,not found,not found,media/data/electrician in sydney/electrician in sydney_2.png
electrician in sydney,Find Electricians Near Me - Australia's #1 Services Site,https://www.service.com.au/find/electrician,"Connect With Local, Verified Trades and Service Providers That Suits Your Needs. Find Now.",not found,not found,not found,not found,media/data/electrician in sydney/electrician in sydney_3.png
electrician in sydney,"Local Electrician - You Fry It, We Fix It",https://business.google.com/v/scr-electrical-pty-ltd/06515468042618897012/d10e/_?,A small family business providing quality workmanship and exceptional electrical services,not found,not found,not found,not found,media/data/electrician in sydney/electrician in sydney_11.png
electrician in sydney,Electricians Level 2 & Electrical Services,https://topelectriciansptyltd.com.au/test/,We are on-call 24/7. Priority for urgent and emergency faults. Quick response *within 1 hr,not found,not found,not found,not found,media/data/electrician in sydney/electrician in sydney_21.png
electrician in sydney,Call Us Now - Your local Electrician,https://www.brightsparxelectrical.com.au/,Bright Sparx Electrical and Security Pty Ltd Bright Sparx Electrical and Security. Your...,not found,not found,not found,not found,media/data/electrician in sydney/electrician in sydney_23.png
electrician in sydney,Electrician Jobs in Sydney NSW 2023 | Indeed.com Australia,https://au.indeed.com/q-electrician-l-sydney-nsw-jobs.html,Thousands of Jobs are Being Added. No Job Search is Complete Without Indeed.,not found,not found,not found,not found,media/data/electrician in sydney/electrician in sydney_29.png
electrician in sydney,$50-$80/Hr Electrician In Sydney - ServiceSeeking.com.au,https://www.serviceseeking.com.au/electricians/quotes,Don't Overpay for Electricians. Australia’s Largest Services Network. Stop Overpaying,not found,not found,not found,not found,media/data/electrician in sydney/electrician in sydney_30.png
electrician in sydney,Acent Labour Hire Solutions - Skilled Tradespeople,https://ascent.onmove.com.au/landing/,Expert construction crews that maximise efficiency for all big and small-scale projects.,not found,not found,not found,not found,media/data/electrician in sydney/electrician in sydney_4.png
electrician in sydney,Expert Electrician 24/7 - Central Coast Electrician,https://deltatechelectrical.com.au/,"Upfront pricing, licensed electricians & 100% customer satisfaction, we've got you covered",not found,not found,not found,not found,media/data/electrician in sydney/electrician in sydney_11.png
electrician in sydney,Glenmore Park - Call N&B Electrical Solutions,https://www.nbelectricalsolutions.com/,Do you live in Glenmore Park and need professional electrical service? N&B is here for you,not found,not found,not found,not found,media/data/electrician in sydney/electrician in sydney_39.png
"plumber Parramatta न्यू साउथ वेल्स, अष्ट्रेलिया",Qualified Plumber Parramatta,https://optimisedplumbingservices.com.au/parramatta/,We'll unblock your toilet or drain today! Call today for $49 off your first service.,not found,not found,not found,not found,"media/data/plumber Parramatta न्यू साउथ वेल्स, अष्ट्रेलिया/plumber Parramatta न्यू साउथ वेल्स, अष्ट्रेलिया_0.png"
plumber in sydney,Emergency Plumber Sydney | 24/7 Emergency Plumbing Services,https://optimisedplumbingservices.com.au/emergency-plumber/,Over 20 years of experience with all plumbing and blockages.,not found,not found,not found,not found,media/data/plumber in sydney/plumber in sydney_45.png
mobile phone repairs australia,Newcastle & Hunter Area - IT Services,https://www.hunterpacd.com/contact-us,"Get a Quick Response by Filling Out This Form. Shop 14 Junction Fair Shopping Centre. Open from 8:30 to 6PM, 5 Days. All Makes and Models. Fast and Reliable. Affordable Rates.",not found,not found,not found,not found,media/data/mobile phone repairs australia/mobile phone repairs australia_2.png
mobile phone repairs australia,Same Day Device Solutions - Family Run Zetland Store,https://www.go.spmobile.com.au/,Highly Qualified Staff Trained To Help Solve Device Issues. Contact Us Today. We've Got Your Devices Covered. Tell Us How We Can Help Today.,not found,not found,not found,not found,media/data/mobile phone repairs australia/mobile phone repairs australia_3.png
mobile phone repairs australia,Phone Technician Near Me - Home Phone Setup and Repair,https://www.phonedatapoints.com.au/phone-line-setup/,"Fast, Reliable, and Effective phone Installation and Repair Services by Phone Data Points.",not found,not found,not found,not found,media/data/mobile phone repairs australia/mobile phone repairs australia_4.png
mobile phone repairs australia,The Best Phone Shop Sydney - Find Cell Phones Repair Shop,https://themobileshop.com.au/landing-page-new/,We are a Premium Mobile Store in Bondi Junction. Walk-in or call today! Find latest Mobile...,not found,not found,not found,not found,media/data/mobile phone repairs australia/mobile phone repairs australia_5.png
maid service houston,Maid Brigade of SE Houston - Home Cleaning Services,https://www.maidbrigade.com/tx/clear-lake/home-cleaning-service-seh-ppc/,"Maid Brigade has over 25 years of experience in providing safe & healthy house cleanings. Trusted house cleanings and safe disinfection for homes in Deer Park,...",not found,not found,not found,not found,media/data/maid service houston/maid service houston_0.png
maid service houston,Maid Service Houston - Two Maids,https://twomaidscleaning.com/pearland/,"Our team has been professionally trained to deliver high-quality house cleaning services. Choose the cleaning option that works for you, and check cleaning off your to-do list.",not found,not found,not found,not found,media/data/maid service houston/maid service houston_1.png
maid service houston,The Maids of West Houston - We're the most requested maids,https://www.maids.com/services/cleaning-for-health/,"If you are like most, you want a clean home but can't find the time to keep it that way. You...",not found,not found,not found,not found,media/data/maid service houston/maid service houston_2.png
maid service houston,Best Maid Service in Houston - Personalized Cleaning Services,https://maidluxellc.com/,One-time or Recurring Cleaning Services Available from Houston's Best Maid Services.,not found,not found,not found,not found,media/data/maid service houston/maid service houston_3.png
"maid service Conroe, टेक्सस, संयुक्त राज्य अमेरिका",Conroe Maid Service - Maid Service Near Me,https://twomaidscleaning.com/conroe/,"Pick the home cleaning option that works for you, and check cleaning off your to-do list. Get your home cleaned, and get more time back in your day - call or book online today! Monthly Cleaning. Move-In/Move-Out Cleaning. Licensed, Bonded, Insured. Bi-Weekly Cleaning.",not found,not found,not found,not found,"media/data/maid service Conroe, टेक्सस, संयुक्त राज्य अमेरिका/maid service Conroe, टेक्सस, संयुक्त राज्य अमेरिका_0.png"
maid service dc,Pro Home Cleaning Service - House Cleaners Near Me,https://www.regalmaidservice.com/sterling-virginia/,"Licensed, bonded, and insured. We thoroughly train and background-check every employee. Since 1995, Regal Maid Service has been a trusted name in the house cleaning industry.",not found,not found,not found,not found,media/data/maid service dc/maid service dc_3.png
maid service dc,Maid Service Experts - 5-Star Rated Maid Services,https://belloscleaning.com/ad/,Our cleaners are eager for you to experience our 5-Star house cleaning! Get a...,not found,not found,not found,not found,media/data/maid service dc/maid service dc_4.png
maid service dc,First 2-Hour Cleaning for $9 - Maid Service - Starting At $9,https://www.dazzlingcleaning.com/deal,"Affordable, Top-Rated Cleaners with Next-Day Availability. Book Now! 100% Satisfaction...",not found,not found,not found,not found,media/data/maid service dc/maid service dc_5.png
maid service dc,Full Time Live In Maid - A Live In Maid,https://helpinghandshouseholdstaffing.com/nurses/,"Our Managers are focused on your privacy, & will take care of your home just as you would.",not found,not found,not found,not found,media/data/maid service dc/maid service dc_6.png
electrician in america,"American Electrician Jobs, Employment | Indeed.com",https://www.indeed.com/m/jobs?q=American+Electrician,"Search For Construction Job Opportunities By Experience, Location, Salary and More.",not found,not found,not found,not found,media/data/electrician in america/electrician in america_3.png
electrician in america,Licensed Electricians - Electrician in Sacramento,https://www.vitalityelectric.com/,"15+ years of experience electrical works. Electrical repair and Installation. EV charges. Hot tub, electrical panels, lighting fixtures. Quantity guarantee, safety first.",not found,not found,not found,not found,media/data/electrician in america/electrician in america_8.png
electrician in america,"Electrician Jobs, Employment in United States | Indeed.com",https://www.indeed.com/q-Electrician-l-United-States-jobs.html?vjk=c46036eb525e3dcf,Are you new job ready? Find your next job today!,not found,not found,not found,not found,media/data/electrician in america/electrician in america_15.png
gym in sydney,Impact Gym Erina - Best fitness gym,https://impactgym.com.au/,"At Impact, We Are More Than A Gym Membership, We Offer Complete Healthy Lifestyle Coaching. Inspiring Your Mental Performance Just As Much As Your Bodies Performance ...",not found,not found,not found,not found,media/data/gym in sydney/gym in sydney_0.png
gym in sydney,3 Weeks Free + No Joining Fee - Newly Refurbished,https://www.plusfitness.com.au/gyms/mona-vale/,"Plus Fitness Mona Vale Is Getting The Ultimate Glow Up! Get 3 Weeks Free + No Joining Fee! Brand New Cardio + Strength Gear, & We’re Adding Even More...",not found,not found,not found,not found,media/data/gym in sydney/gym in sydney_1.png
gym in sydney,Fernwood Gym Campbelltown - 24/7 Gym For Women,https://join.fernwoodfitness.com.au/offer/campbelltown/,"Women's 24/7 Gym Membership with Group Fitness, Yoga, Pilates, Weights, Cardio & More.",not found,not found,not found,not found,media/data/gym in sydney/gym in sydney_2.png
gym in sydney,Affordable Membership Options - State-of-the-art Gym in Sydney,https://www.mountieshealthandfitness.com.au/gym,Mounties health and fitness gym offers state-of-the-art equipment for a complete workout.,not found,not found,not found,not found,media/data/gym in sydney/gym in sydney_3.png
"gym Parramatta न्यू साउथ वेल्स, अष्ट्रेलिया",Snap Fitness 24/7 Kellyville - Brand New 24/7 Gym Coming Soon,https://snapnation.com.au/offer/maitland/,Brand New Snap Fitness Gym Coming to North Kellyville. Foundation Memberships On Sale Now! Affordable 24/7 Gym Membership. Start Your Fitness Journey at Snap Fitness...,not found,not found,not found,not found,"media/data/gym Parramatta न्यू साउथ वेल्स, अष्ट्रेलिया/gym Parramatta न्यू साउथ वेल्स, अष्ट्रेलिया_0.png"
"gym Parramatta न्यू साउथ वेल्स, अष्ट्रेलिया",Fernwood Fitness Parramatta - 24/7 Gym For Women,https://join.fernwoodfitness.com.au/offer/,"Women's 24/7 Gym Membership with Group Fitness, Yoga, Pilates, Weights, Cardio & More. Month-to-Month Memberships. 70+ Locations. Experts In...",not found,not found,not found,not found,"media/data/gym Parramatta न्यू साउथ वेल्स, अष्ट्रेलिया/gym Parramatta न्यू साउथ वेल्स, अष्ट्रेलिया_1.png"
electrician in america,Production Electrical Services - Electrical Maintenance,https://www.allphasela.com/,"Fully Licensed & Insured. Electrical Contractor in Louisiana, Texas, and Surrounding Areas. All Phase Electrical Service has over 40 years of industrial electrical experience.",not found,not found,not found,not found,media/data/electrician in america/electrician in america_20.png
electrician in america,Electric Bros. Co. - Residential Electricians,https://electricbro.com/,Honest & Reliable Electrical Contractor. Call And Schedule A Free Estimate Today.,not found,not found,not found,not found,media/data/electrician in america/electrician in america_23.png
"gym Parramatta न्यू साउथ वेल्स, अष्ट्रेलिया",Snap Fitness 24/7 Cronulla - Start For Just $4pw For 4wks,https://snapnation.com.au/4-for-4-weeks/cronulla,"Start your 24/7 Snap Fitness Gym Journey Today & Move Your Way with $4pw for 4 weeks. Discover our supportive community, state-of-the-art facilities, and friendly trainers.",not found,not found,not found,not found,"media/data/gym Parramatta न्यू साउथ वेल्स, अष्ट्रेलिया/gym Parramatta न्यू साउथ वेल्स, अष्ट्रेलिया_6.png"
plumber in sydney,Plumber Austral - SPS Plumbers Western Sydney,https://www.spsplumberswesternsydney.com.au/,"After Hours Plumbers Nearby To Help, Leaking Tap? Rely On Us For Fast Solutions! Call Us",not found,not found,not found,not found,media/data/plumber in sydney/plumber in sydney_18.png
"plumber Penrith न्यू साउथ वेल्स, अष्ट्रेलिया","Plumber Penrith - 24 Hours, 4.7 Rated Plumbers",https://spsplumbers.com.au/,"On Call 24 Hour Plumbers, Local Award Winners! $0 Call Out* Prompt Response....",not found,not found,not found,not found,"media/data/plumber Penrith न्यू साउथ वेल्स, अष्ट्रेलिया/plumber Penrith न्यू साउथ वेल्स, अष्ट्रेलिया_1.png"
plumber in sydney,#1 Local Plumbing Specialists - Sydney's Most Trusted Plumbers,https://fixnflow.com.au/emergency-plumber/,#1 Local Plumbing Specialists! 60 Minute* Response. Fixed Price Services. Book Online,not found,not found,not found,not found,media/data/plumber in sydney/plumber in sydney_20.png
electrician in america,"Foley Electric - Electrical Services, MA",https://www.foleyelectrical.com/,We Have Been In The Electrical Service Business With Over 12 Years Of Experience.,not found,not found,not found,not found,media/data/electrician in america/electrician in america_46.png
electrician in america,Electrical Engineering & Build - Commercial Fire Alarm System,https://www.amteck.com/,"Ask Us About Infrastructure Cabling, Business Video Surveillance, and Audio Visual Install",not found,not found,not found,not found,media/data/electrician in america/electrician in america_47.png
electrician in america,Aiello Home Services - Local Master Electricians,https://www.aiellohomeservices.com/electrical,"Offering Electrical Repair, Wiring, Lighting, Fuse Box & Circuit Breaker & More! Quality Service. BBB Rated. Family Owned & Operated. Call 24/7. Upfront Prices. 5 Star Rated.",not found,not found,not found,not found,media/data/electrician in america/electrician in america_51.png
electrician in america,Electrical Contractor - Local Electricians,http://offer.r7jelectrical.com/,Electrical Contractor With Years Of Experience. Call Now For Further Information!,not found,not found,not found,not found,media/data/electrician in america/electrician in america_53.png
electrician in america,Kingdom Electric - Request A Quote - Quality Electrical Solutions,https://kingdomelectric.pro/,We Take Pride in Providing Quality Electrical Solutions. Kingdom Electric – Your safety is...,not found,not found,not found,not found,media/data/electrician in america/electrician in america_58.png
electrician in america,Local Electrician - Outlet Installation and Repair,https://dadzelectrical.com/,"Contact us and we can continue the conversation, never in a rush and always with patience. We provide the electrical repairs, upgrades and installations you need. Contact Us now!",not found,not found,not found,not found,media/data/electrician in america/electrician in america_62.png
electrician in america,Licensed Electricians - Residential & Commercial,https://web.mrelectric.com/knoxville/home,"Neighborly Done Right Promise. If It’s Not Done Right, We Promise To Make It...",not found,not found,not found,not found,media/data/electrician in america/electrician in america_63.png
