query,title,url,description,contact_number,Company board members,screenshot
electrician in america,Commercial Electrical Services in RI & Massachusetts,https://askgem.com/commercial/electrical/,"We Are Here for All Your Maintenance, Repair or Installation Needs. Industry Leading Techs.",not found,not found,not found,not found,media/data/electrician in america/electrician in america_84.png
"Plumber, Urgent Gold Coast 4207 QLD",24/7 Plumbers Gold Coast - 24/7 Availability,https://qldcoastalplumbing.com.au/,"We Offer Residential Plumbing Services In The Gold Coast, Burleigh, Robina & Surrounding. Blocked Drains, Hot Water Systems, Leak Detection, Toilet Repairs,...",Not Found,Not Found,Not Found,Not Found,Not Found,"media/data/Plumber, Urgent Gold Coast 4207 QLD/Plumber, Urgent Gold Coast 4207 QLD_16.png"
"Plumber, Urgent Gold Coast 4207 QLD","Plumber Tamborine - We're On Call 24 Hours, 7 Days",https://plumbprofessor.com.au/,Industry Low Pricing On Burst Pipe Services! Fully Licensed Specialists. Get In Touch. Speedy Same Day Plumbers Equipped For Burst Pipes. Upfront Pricing....,Not Found,Not Found,Not Found,Not Found,Not Found,"media/data/Plumber, Urgent Gold Coast 4207 QLD/Plumber, Urgent Gold Coast 4207 QLD_17.png"
"Plumber, Urgent Gold Coast 4207 QLD",Local ‪Local Plumber‬ - No Callout Fee - Today Only,https://www.qldplumber.com.au/,Save Time & Money - 100% Guaranteed Satisfaction - Call Us To Book A Local Plumber Today,+61 7 3273 0800,Not Found,info@mpaq.com.au,Not Found,Not Found,"media/data/Plumber, Urgent Gold Coast 4207 QLD/Plumber, Urgent Gold Coast 4207 QLD_18.png"
"Plumber, Urgent Gold Coast 4207 QLD","Plumber Coomera - Affordable, reliable plumber",https://www.wyattsplumbingcoomera.com.au/,"Northern Gold Coast All Areas - general plumbing, gas, hot water, blocked drains",+61 415 190 349,Not Found,wyattsps@gmail.com,Not Found,Not Found,"media/data/Plumber, Urgent Gold Coast 4207 QLD/Plumber, Urgent Gold Coast 4207 QLD_19.png"
plumber in sydney,Affordable Plumbing Services - Allscope Plumbing - Call Now,https://allscopeplumbing.com.au/services/emergency-plumbing/,"From burst pipes to blocked drains, we have the expertise to solve your plumbing problem",Not Found,Not Found,Not Found,Not Found,Not Found,,media/data/plumber in sydney/plumber in sydney_3.png
Electrician Urgent Gold Coast 4207 QLD,24 Hour Electricians - 24hr electrician near me,https://vanumelectrical.com.au/24-hour-emergency-electricians/,We Have a Team of Emergency Electricians on Hand 24 Hours a Day for When You Need It Most. No Job Is Too Big or Small. Get in Touch with Our Brisbane 24 Hour Electricians...,Not Found,Not Found,Not Found,Not Found,Not Found,,media/data/Electrician Urgent Gold Coast 4207 QLD/Electrician Urgent Gold Coast 4207 QLD_7.png
Removalist  commercial  Melbourne 3000 MEL,House Removals Melbourne - Interstate House Moving,https://www.brillianceremovalistsmelbourne.com.au/lp1/,Melbourne’s leading Removalists operating right across all regions & suburbs....,+61 1300 112 715,Not Found,info@brillianceremovalistsmelbourne.com.au,Not Found,Not Found,,media/data/Removalist  commercial  Melbourne 3000 MEL/Removalist  commercial  Melbourne 3000 MEL_0.png
Electrician Urgent Brisbane 4000 QLD,LED Light Installation - Down Light Fitting - LED Lighting Installer,https://pacificpowersystems.com.au/landing-page-general/,"Whether you’re looking for help with repairs or installations, we have you covered. Renovations. EV Charging Stations. New Homes. We have the expertise to deliver the best electrical services for residential homes. Light Switches. Light & Power Installs.",Not Found,Not Found,Not Found,Not Found,Not Found,,media/data/Electrician Urgent Brisbane 4000 QLD/Electrician Urgent Brisbane 4000 QLD_0.png
Electrician Urgent  Parramatta 2150 NSW,Available 24/7 Sydney Wide - Servicing All Greater Sydney,https://cforceelectrical.com.au/,"Powerline works, emergency works, meter defects & more. Full service Level 2 electricians. CForce Electrical provides the highest standard of level 2 electrical work across Sydney. Fixed Fee Pricing. Licensed Experts. 24/7 Emergency Service.",Not Found,Not Found,Not Found,Not Found,Not Found,,media/data/Electrician Urgent  Parramatta 2150 NSW/Electrician Urgent  Parramatta 2150 NSW_0.png
Electrician Urgent  Parramatta 2150 NSW,24/7 Parramatta Electrician - 24/7 Call Out 1 Hour Response,https://electrician.sydney/electrician-parramatta/,"Electrician Parramatta Call Now Your Local Electrician. 24 Hours, 7 Days, After Hours. 24- Hours, 7 Days, After Hours, Emergency Services. Call Now Your Local Electrician.",Not Found,Not Found,Not Found,Not Found,Not Found,,media/data/Electrician Urgent  Parramatta 2150 NSW/Electrician Urgent  Parramatta 2150 NSW_1.png
Electrician cheap  Parramatta 2150 NSW,NSW Electrical Contractors - 45 Years Wide Experience,https://caslec.com.au/services/electrical-installations/,We Are Medium To Large Scale Electrical Installation Contractors. Call Us Now!,Not Found,Not Found,Not Found,Brain Cassidy,Not Found,,media/data/Electrician cheap  Parramatta 2150 NSW/Electrician cheap  Parramatta 2150 NSW_1.png
Electrician cheap  Parramatta 2150 NSW,Handyman Near Me - $20-$30/Hr - 10 Best Rated Handymen...,https://handymannearme.net.au/,Request A Quote From All Matching Businesses. Customers Report Saving Up To 40%...,DIRECT PUBLISHING PTY LTD,Not Found,+61 1300 300 030,Not Found,Not Found,,media/data/Electrician cheap  Parramatta 2150 NSW/Electrician cheap  Parramatta 2150 NSW_2.png
Electrician cheap  Parramatta 2150 NSW,24 Hours Licenced Electrician - 24H 7D Expert Electrician,https://izcoelectrical.com.au/emergency-electrician/,"24 Hour Licenced Electrician. Prompt Service. Trusted, Reliable & Affordable. Call Now",Not Found,Not Found,Not Found,Iman Zarepour,Not Found,,media/data/Electrician cheap  Parramatta 2150 NSW/Electrician cheap  Parramatta 2150 NSW_3.png
Electrician cheap  Parramatta 2150 NSW,$50-$80/Hr Affordable Electrician - Lowest Possible Price,https://www.serviceseeking.com.au/electricians/3,Don't Overpay for Electricians. Australia’s Largest Services Network. Stop Overpaying,support@serviceseeking.com.au,Not Found,Price Range · $,Daniel Sabados,Not Found,,media/data/Electrician cheap  Parramatta 2150 NSW/Electrician cheap  Parramatta 2150 NSW_5.png
Electrician Urgent Brisbane 4000 QLD,24/7 Local Electrician - 24/7 Brisbane Electrician,https://www.sparc-electrical.com.au/,Domestic & Commercial Electrician. 24/7 Emergency Callout Sparkies. Reliable &...,Not Found,Not Found,Not Found,Not Found,Not Found,,media/data/Electrician Urgent Brisbane 4000 QLD/Electrician Urgent Brisbane 4000 QLD_1.png
Electrician Urgent Gold Coast 4207 QLD,Book Your Electrical Job Now - Huge Range Of Services,https://electricalcontractorsgoldcoast.com.au/,"Smoke Alarms, Ceiling Fans, Lighting, Power Points, Air Conditioning Services. Call Your Local Electrician Patrik, Save Your Spot And Book Your Job Today....",Not Found,Not Found,Not Found,Justin Nisbett,Not Found,,media/data/Electrician Urgent Gold Coast 4207 QLD/Electrician Urgent Gold Coast 4207 QLD_2.png
"Electrician Urgent Yatala क्विन्सल्याण्ड, अष्ट्रेलिया",Fast Electrician Yatala - Electrical Offers [Click Here],https://electricianyatala.com.au/,Family Owned & Operated Electrical Business — 5-Star Service — See What Makes Us Different,Not Found,Not Found,Not Found,Not Found,Not Found,,"media/data/Electrician Urgent Yatala क्विन्सल्याण्ड, अष्ट्रेलिया/Electrician Urgent Yatala क्विन्सल्याण्ड, अष्ट्रेलिया_1.png"
"Electrician ASAP Gold Coast क्विन्सल्याण्ड, अष्ट्रेलिया",Local Electricians - No Job Is Too Big or Small,https://vanumelectrical.com.au/,"Our Technicians Are on Standby 24 Hours a Day, 7 Days a Week for When You Need It Most",Not Found,Not Found,Not Found,Harley Leo Van Maarseveen,Not Found,,"media/data/Electrician ASAP Gold Coast क्विन्सल्याण्ड, अष्ट्रेलिया/Electrician ASAP Gold Coast क्विन्सल्याण्ड, अष्ट्रेलिया_1.png"
"plumber Urgent Yarrabilba क्विन्सल्याण्ड, अष्ट्रेलिया",‪Plumber Yarrabilba - No Callout Fee - Today Only,https://www.qldplumber.com.au/areas/Yarrabilba,Licensed & Qualified Master Plumbers - ‪Local Plumber Yarrabilba - Family Owned Business. Save Time & Money - 100% Guaranteed Satisfaction - Call Us To Book A Local Plumber Today. Upfront Pricing. $0 Callout Fee. Fixed Upfront Prices. 100% Quality Guaranteed.,Not Found,Not Found,Not Found,Not Found,Not Found,,"media/data/plumber Urgent Yarrabilba क्विन्सल्याण्ड, अष्ट्रेलिया/plumber Urgent Yarrabilba क्विन्सल्याण्ड, अष्ट्रेलिया_0.png"
"plumber Urgent Yarrabilba क्विन्सल्याण्ड, अष्ट्रेलिया",OA Plumbing Service in Yarrabilba,https://oaplumbing.com.au/location/oa-plumbing-service-yarrabilba-4207/,"Leaking Pipes, Cisterns, Taps and Toilets. Full Range of Plumbing Services. Hot Water.",+61 1300 161 655,Not Found,sales@oaplumbing.com.au,Ondrave Arkadieff,Not Found,,"media/data/plumber Urgent Yarrabilba क्विन्सल्याण्ड, अष्ट्रेलिया/plumber Urgent Yarrabilba क्विन्सल्याण्ड, अष्ट्रेलिया_1.png"
plumber Urgent Brisbane 4000 QLD,No Callout Fee - $55 Off Today - Parker Plumbing Company,https://plumber.parkerplumbingcompany.com.au/areas/ipswich/Plumber-near-you-in-Ipswich?,Call The Plumber Ipswich Residence Have Trusted For Years. Call Our Friendly Team Today.,Not Found,Not Found,Not Found,Daniel Parker,Not Found,,media/data/plumber Urgent Brisbane 4000 QLD/plumber Urgent Brisbane 4000 QLD_0.png
plumber Urgent Brisbane 4000 QLD,"Plumber Brisbane Northside | 24/7 Plumbing, Gas Fitting",https://hewitttradeservices.com.au/plumbing-brisbane/,Fully Licenced & Qualified. Same/Next Day Service. No Job Too Small. Exceptional Quality. Best Value in Brisbane. Brisbane's Favourite Plumbers. Guarantee On All Workmanship.,+61 7 3634 0200,Not Found,enquiries@hewitttradeservices.com.au,Greg Stafford,Not Found,,media/data/plumber Urgent Brisbane 4000 QLD/plumber Urgent Brisbane 4000 QLD_1.png
plumber Urgent Brisbane 4000 QLD,"Emergency Plumber Morningside - We're Nearby 24 Hours, 7 Days",http://lwplumbing.com.au/,Hot Water Installs Same Day* Licensed Plumbers On Call 24 Hours. Request A Call Back. Reliable Local Plumbers Equipped For Hot Water Installs. Best Pricing. Get In Touch. Reliable Local Plumbers. 15+ Years Experience. Fixed Upfront Pricing. 60* Minute Response.,+61 429 479 267,Not Found,admin@lwplumbing.com.au,Jarod Lancaster,Not Found,,media/data/plumber Urgent Brisbane 4000 QLD/plumber Urgent Brisbane 4000 QLD_2.png
"plumber Urgent Fortitude Valley क्विन्सल्याण्ड, अष्ट्रेलिया",Bracken Ridge 24/7 Emergency Plumbing,https://plumberbrackenridge.com.au/emergency,"Local Plumber Brisbane — Your Local Plumber in Bracken Ridge. Call Us Today. Licensed & Qualified Plumbers — Local Bracken Ridge Plumber Near You — Family Owned. Plumber Bracken Ridge. Destinations: Bracken Ridge, Brisbane, North Lakes, Windsor, Scarborough.",tuesday in CPH,Not Found,"FIGHT DEBATE DIGITAL  :
“is it important to be in advance ? “
Live  !!!!TODAY .Thursday  11 am sharp  
on the  museum,s  instagram live… See more",Not Found,Not Found,,"media/data/plumber Urgent Fortitude Valley क्विन्सल्याण्ड, अष्ट्रेलिया/plumber Urgent Fortitude Valley क्विन्सल्याण्ड, अष्ट्रेलिया_0.png"
plumber ASAP Brisbane 4000 QLD,Local Plumber - No Callout Fee - $55 Off Today,https://plumber.parkerplumbingcompany.com.au/areas/ipswich,Ipswich's Leading Domestic & Residential Plumbing Company - See What Makes Us Different: Call The Plumber Ipswich Residence Have Trusted For Years. Call Our Friendly...,Not Found,Not Found,Not Found,Daniel Parker,Not Found,,media/data/plumber ASAP Brisbane 4000 QLD/plumber ASAP Brisbane 4000 QLD_0.png
plumber ASAP Brisbane 4000 QLD,Plumber Near Me - $50 Off — Book Online & Save,https://plumberwindsor.com.au/,Speedy Same Day Response On All Plumbing Services Nearby. Upfront Fixed Pricing. Call Now.,+61 3 9329 9622,Not Found,info@plumber.com.au,Not Found,Not Found,,media/data/plumber ASAP Brisbane 4000 QLD/plumber ASAP Brisbane 4000 QLD_2.png
"plumber ASAP Queen St, Brisbane City",0488 Plumber Brisbane - $0* Call Out Fee. Ready 24/7,https://www.0488plumbr.com.au/,"Blocked Drains Cleared From $29* Don't DIY - Call The Experts. Book An Onsite Free* Quote! Brisbane's #1 Local Plumbers! Specialising In Blocked Sewer Repairs From $29* Book Today. Ready 24 Hours, 7 Days. Book A Free* Quote. Not Happy? $100 Cashback*.",Not Found,Not Found,Not Found,0488PLUMBR PTY LTD,Not Found,,"media/data/plumber ASAP Queen St, Brisbane City/plumber ASAP Queen St, Brisbane City_0.png"
"plumber ASAP Queen St, Brisbane City",‪Plumber South Brisbane - No Callout Fee - Today Only,https://www.qldplumber.com.au/areas/South-Brisbane,Licensed & Qualified Master Plumbers - ‪Local Plumber South Brisbane - Family Owned Business,Not Found,Not Found,Not Found,Not Found,Not Found,,"media/data/plumber ASAP Queen St, Brisbane City/plumber ASAP Queen St, Brisbane City_2.png"
"Electrician Urgent Yatala क्विन्सल्याण्ड, अष्ट्रेलिया",Electrician Yatala - Knights Electrical Contracting,https://www.knightselectrical.net.au/Electrical-contractors/,Licensed Electricians Providing Local Powerpoint Repairs Same Day. Book an...,Not Found,Not Found,Not Found,Not Found,Not Found,,"media/data/Electrician Urgent Yatala क्विन्सल्याण्ड, अष्ट्रेलिया/Electrician Urgent Yatala क्विन्सल्याण्ड, अष्ट्रेलिया_3.png"
plumber Urgent Gold Coast 4207 QLD,Local Plumber in Brisbane - No Callout Fee - Today Only,https://www.qldplumber.com.au/need-a/plumber-near-you,"Your Local Plumber of Choice 2022 - Call Now for a $0 Callout Fee - Save $55 (Today Only) Qualified, Local Plumber with Fixed Price, Low Rates & Residential or Commercial Work.",+61 432 623 466,Not Found,Admin@a-listplumbing.com.au,Not Found,Not Found,,media/data/plumber Urgent Gold Coast 4207 QLD/plumber Urgent Gold Coast 4207 QLD_6.png
plumber Urgent Gold Coast 4207 QLD,24/7 Emergency Plumbing - 24 hr plumbers near me,https://provenplumbingandgas.com.au/plumbing-services/24-7-emergency-plumbing/,At Proven Plumbing & Gas Services Pty Ltd we specialise in all plumbing and gas services,"Jimboomba, QLD, Australia · Brisbane, QLD, Australia · Ipswich, QLD, Australia · Gold Coast, QLD, Australia · Browns Plains, QLD, Australia",Not Found,+61 7 3130 0927,Not Found,Not Found,,media/data/plumber Urgent Gold Coast 4207 QLD/plumber Urgent Gold Coast 4207 QLD_9.png
plumber Urgent Brisbane 4000 QLD,Coorparoo 24/7 Emergency Plumbing ‐ Coorparoo,https://plumbercoorparoo.com.au/emergency,Local Plumber Brisbane — Your Local Plumber in Coorparoo. Call Us Today. Licensed ...,tuesday in CPH,Not Found,"FIGHT DEBATE DIGITAL  :
“is it important to be in advance ? “
Live  !!!!TODAY .Thursday  11 am sharp  
on the  museum,s  instagram live… See more",Not Found,Not Found,,media/data/plumber Urgent Brisbane 4000 QLD/plumber Urgent Brisbane 4000 QLD_6.png
"plumber Urgent Spring Hill क्विन्सल्याण्ड, अष्ट्रेलिया",Plumbing Supply - Services in Townsville,https://plumbertoyourdoor.com.au/,"We Offer Competitive Prices, Free Quotes, Honest Plumbing Work & 24/7 Call Outs. Our...",Not Found,Not Found,Not Found,Not Found,Not Found,,"media/data/plumber Urgent Spring Hill क्विन्सल्याण्ड, अष्ट्रेलिया/plumber Urgent Spring Hill क्विन्सल्याण्ड, अष्ट्रेलिया_0.png"
plumber ASAP Gold Coast 4207 QLD,Dial-A-Plumber Services on the Gold Coast,https://www.goldcoastplumber.com.au/gold-coast,"1 Hour Response Time, Quality Service, Professional Plumber With 40 Years In GC.","Gold Coast, QLD, Australia",Not Found,+61 1300 390 361,Not Found,Not Found,,media/data/plumber ASAP Gold Coast 4207 QLD/plumber ASAP Gold Coast 4207 QLD_3.png
plumber ASAP Brisbane 4000 QLD,Local Plumber Near Me - $50 Off — Book Online & Save,https://plumberstoowong.com.au/,Speedy Same Day Response On All Plumbing Services Nearby. Upfront Fixed Pricing. Call Now.,+61 1300 273 762,Not Found,Info@professionalsaustralia.org.au,Not Found,Not Found,,media/data/plumber ASAP Brisbane 4000 QLD/plumber ASAP Brisbane 4000 QLD_7.png
plumber ASAP Brisbane 4000 QLD,Sandgate Plumber Near You - $50 Off — Book Online & Save,https://plumberssandgate.com.au/,Speedy Same Day Response On All Plumbing Services Nearby. Upfront Fixed Pricing. Call Now.,Not Found,Not Found,Not Found,Not Found,Not Found,,media/data/plumber ASAP Brisbane 4000 QLD/plumber ASAP Brisbane 4000 QLD_11.png
Electrician Urgent Gold Coast 4207 QLD,Emergency Electrician - Brisbane Emergency Electrician,https://moranpowersolutions.com.au/brisbane-electrician-promo/?title=Local%20Emergency%20Electrician,Brisbane's #1 Choice For Electrical Services. Over 17 Years Electrical Experience. 100...,+61 7 3820 3999,Not Found,info@moranpowersolutions.com.au,Martin Moran,Not Found,,media/data/Electrician Urgent Gold Coast 4207 QLD/Electrician Urgent Gold Coast 4207 QLD_9.png
plumber Urgent Brisbane 4000 QLD,Toowong 24/7 Emergency Plumbing ‐ Toowong,https://plumberstoowong.com.au/emergency,Speedy Same Day Response On All Plumbing Services Nearby. Upfront Fixed Pricing. Call Now.,Not Found,Not Found,Not Found,Not Found,Not Found,,media/data/plumber Urgent Brisbane 4000 QLD/plumber Urgent Brisbane 4000 QLD_8.png
Electrician Urgent Brisbane 4000 QLD,Upfront Fixed Pricing - 24 Hour Electricians Nearby,https://spanoselectricool.com.au/electrical-services/emergency-electrician-after-hours/,Electrical Emergency? Upfront Fixed Pricing. Available 24/7. 1 Hour Service. Call Now. Need an electrician now? We can be there within 1 hour. Upfront Fixed...,+61 7 3349 3134,Not Found,info@spanoselectricool.com.au,Julia Spanos,Not Found,,media/data/Electrician Urgent Brisbane 4000 QLD/Electrician Urgent Brisbane 4000 QLD_13.png
Electrician Urgent Brisbane 4000 QLD,Jetset Electrical - Licensed and Experienced,https://jetsetelectrical.com.au/brisbane-electricians/,Full Electrical Installation & Repairs. $0 Call Out Fee. Gold Standard Of Service. Best...,Not Found,Not Found,Not Found,Not Found,Not Found,,media/data/Electrician Urgent Brisbane 4000 QLD/Electrician Urgent Brisbane 4000 QLD_15.png
plumber Urgent Brisbane 4000 QLD,Available 24/7 - No Call Out Fees - An Affordable Plumber,https://www.parallelplumbinggas.com.au/plumber-capalaba/,"Looking For An Affordable, Reliable And Fully Qualified Plumber? Call Us Today For a Quote","Jimboomba, QLD, Australia · Brisbane, QLD, Australia · Redland Bay, QLD, Australia · Ormeau, QLD, Australia · Tamborine, QLD, Australia · Gold Coast, QLD, Australia",Not Found,+61 409 032 954,Benjamin Anderson,Not Found,,media/data/plumber Urgent Brisbane 4000 QLD/plumber Urgent Brisbane 4000 QLD_14.png
Electrician Urgent Gold Coast 4207 QLD,Electrical Company Gold Coast - Local Gold Coast Electricians,https://jetsetelectrical.com.au/gold-coast-electricians/,Best Electrical Service on the Gold Coast. 5 Star Service. 100% Satisfaction Guarantee. Full Electrical Installation & Repairs. $0 Call Out Fee. Gold Standard Of Service.,Not Found,Not Found,Not Found,Not Found,Not Found,,media/data/Electrician Urgent Gold Coast 4207 QLD/Electrician Urgent Gold Coast 4207 QLD_15.png
plumber Urgent Gold Coast 4207 QLD,24 Hour Plumbing - Get A Free Quote - Plumbers And Gas Fitters,https://www.shawspg.com.au/services/residential-plumbing/,Shaw’s Offers Modern Solutions To Suit Your Household’s Plumbing And Gas Requirements.,Not Found,Not Found,Not Found,Not Found,Not Found,,media/data/plumber Urgent Gold Coast 4207 QLD/plumber Urgent Gold Coast 4207 QLD_23.png
Electrician Urgent Gold Coast 4207 QLD,$40 Off When You Book Online - Electricians on the Gold Coast,https://www.fullyelectric.com.au/,"Servicing Gold Coast and Surrounding Areas, We can have an electrician at your door Today",Not Found,Not Found,Not Found,Not Found,Not Found,,media/data/Electrician Urgent Gold Coast 4207 QLD/Electrician Urgent Gold Coast 4207 QLD_21.png
plumber Urgent Gold Coast 4207 QLD,24Hr Emergency Plumber - Dr. Plumbing & Gas Gold Coast,https://www.drplumbingandgas.com.au/emergency-plumbing.html,$0 Call out fee & fixed pricing 24/7. Your emergency plumber on the Gold Coast. Open now. Call our team today to take care of your plumbing needs ASAP. Fast Response Times. Over 10 Years' Experience. 12 Month Warranty.,Not Found,Not Found,Not Found,Not Found,Not Found,,media/data/plumber Urgent Gold Coast 4207 QLD/plumber Urgent Gold Coast 4207 QLD_24.png
