query,title,url,description,contact_number,Company board members,screenshot
plumber in sydney,Killara Plumbing | Specialist Upper North Shore Sydney Plumber,https://www.killaraplumbing.com.au/,"Blocked drains, hot water, toilet repairs, pipe relining & more. Get in touch today! Get fixed...",No contact number found,,media/data/plumber in sydney/plumber in sydney_0.png
plumber in sydney,Sydney Plumber - Emergency 24/7 Available,https://www.groundupplumbingandgas.com.au/,"Great Service & Happy Clients Means Everything to Us. Taps, Toilets, Sinks, Gutters & more",0425374231,,media/data/plumber in sydney/plumber in sydney_1.png
plumber in sydney,Fully Licensed Plumbers - emergency plumbing repair service,https://www.accreditedplumbingsouthcoast.com.au/,Fully Licensed. We Turn Up On Time. Gas/HWS/Toilets/Taps/Emergencies,150.4791918,,media/data/plumber in sydney/plumber in sydney_2.png
plumber in sydney,TASM Plumbing - Local Plumbers - $0 Call Out,https://tasmplumbing.com.au/,Looking for a local plumber you can trust? TASM Plumbing is a family owned business. Our...,No contact number found,,media/data/plumber in sydney/plumber in sydney_3.png
plumber in sydney,Plumbing Sydney - Plumbers Near Me,https://www.sydplumbinginspectors.com.au/,"Upfront Rates . Request A Call Back. Weekday Rates On Weekends. Highly Trained Staff. 24 Hour Plumbers, $0 Call Out* On Time 24/7. No Hidden Costs. We Have 5 Star Reviews. Family-Owned & Operated. View Services. Expert Plumbers.",,,media/data/plumber in sydney/plumber in sydney_8.png
plumber in sydney,Residential Plumbing Services Sydney | Bear Plumbing,https://www.bearplumbing.com.au/residential/,We Are Dedicated to Offering Affordable Plumbing and World-class Service. Call...,,,media/data/plumber in sydney/plumber in sydney_9.png
plumber in sydney,Drain Plumbers Sydney NSW,https://www.swiftplumbing.com.au/,60 Minute Fast Service. 24 hrs All Sydney areas. Free Hot Water Inspection.,,,media/data/plumber in sydney/plumber in sydney_10.png
plumber in sydney,Local Plumbers - Request A Quote - Hot Water Repairs,https://priorityplusplumbing.com.au/,Local 24 hour drain specialists in Sydney ready for emergency clearing of blocked drain,0289995019,"['The Boulevarde', 'New South', 'Priority Plus', 'The Boulevarde', 'New South', 'Priority Plus', 'Hour Emergency', 'Plumber Sutherland', 'Peter Honey', 'Peter Honey', 'Hour Emergency', 'Plumber Sutherland', 'Priority Plus', 'Sutherland Shire', 'Peter Honey', 'Hour Emergency', 'Plumber Sutherland', 'Peter Honey', 'Priority Plus', 'Sutherland Shire']",media/data/plumber in sydney/plumber in sydney_11.png
electrician in australia,"Electrician Ipswich, QLD Local - Quality assured Electricians",https://www.thermospark.com.au/,"Qualified Electrician team servicing Ipswich & Brisbane. All electrical services. Guaranteed workmanship. Reliable & Professional. Services: Residential electrial, Air Conditioners.",not found,not found,media/data/electrician in australia/electrician in australia_0.png
electrician in australia,Electrician Jobs 2023 | Indeed.com Australia,https://au.indeed.com/Electrician-jobs,We'll help you find what you want and what you need in your job search. Begin an easier...,not found,not found,media/data/electrician in australia/electrician in australia_1.png
electrician in australia,Schneider Electric™ - Licensed Electrical Contractor,https://www.se.com/au/en/partners/contractors/,Join our Partner Program Grow your business and streamline your work at the same time,not found,not found,media/data/electrician in australia/electrician in australia_2.png
electrician in australia,How to become an electrician - NECA Education and Careers,https://necaeducation.com.au/training-with-us/preapprenticeship/how-to-become-an-electrician/,NECA Education & Careers is the only Victorian RTO electrical industry owned and operated.,not found,not found,media/data/electrician in australia/electrician in australia_3.png
electrician in australia,Fisher Bros Electrical - Electrical Maintenance,https://fisherbros.com.au/,"From The Large Builder to the Smallest Maintenance Request, We are Here to Help You. Family Owed Business That Specialises in All Types of Electrical Works. Book Now.",not found,not found,media/data/electrician in australia/electrician in australia_4.png
electrician in australia,Electrical Contractors - Electrical Services Queensland,https://scholzelectrical.com.au/electrical/commercial-electrical-services/,"We specialise in residential, commercial & industrial electrical services",not found,not found,media/data/electrician in australia/electrician in australia_5.png
electrician in australia,Local Electrician In Melbourne - Top Electrical Contractors,https://www.laneelectrical.com.au/,Need Professional Electrical Services? Our Local Electricians Are Ready To Help. Call Now. Leading Electrical Contractors Offering Transparent Pricing & Free Estimates. Contact Now.,not found,not found,media/data/electrician in australia/electrician in australia_12.png
electrician in australia,Electrician Jobs (with Salaries) 2023 - Indeed.com Australia,https://au.indeed.com/q-electrician-jobs.html,Get connected to better opportunities with helpful job search tools and tips.,not found,not found,media/data/electrician in australia/electrician in australia_18.png
electrician in australia,"Electrician Needed - The Right Choice, Guaranteed",https://www.rfes.com.au/response/,Electrician Needed. Australia's Highest Rated Electrician. Quality Workmanship...,not found,not found,media/data/electrician in australia/electrician in australia_21.png
plumber in sydney,Plumbing Services | Commercial Plumbing Near Me | Killara...,https://www.killaraplumbing.com.au/plumbing-services,"Get fixed price home plumbing services on Sydney's North Shore. Book a plumber now. Blocked drains, hot water, toilet repairs, pipe relining & more. Get in touch today!",not found,not found,media/data/plumber in sydney/plumber in sydney_20.png
scholarships in australia,Scholarship opportunities - Study abroad in Australia,https://www.newcastle.edu.au/study/international/south-asia,Study at a top 200 university in the world. Internationally recognised degree programs. Up to 7 years post-study work opportunities in Australia. Scholarships available.,not found,not found,media/data/scholarships in australia/scholarships in australia_0.png
scholarships in australia,Study In Australia - Apply Now for 2023 Intakes,https://studyabroad.aeccglobal.com.np/study-in-australia-2023/?utm_source=Google&utm_details=Google_PPC&utm_campaign=20076898024&utm_content=150281349482&utm_term=,Australia’s universities offer the best international exposure. Register today with AECC.,not found,not found,media/data/scholarships in australia/scholarships in australia_1.png
scholarships in australia,40 Scholarships Available - Apply Now,https://education.nsw.gov.au/teach-nsw/get-paid-to-study/graduate-teacher-scholarship,Are you a final year teacher education student? Apply for the Graduate Teacher Scholarship,not found,not found,media/data/scholarships in australia/scholarships in australia_2.png
scholarships in australia,Applications open for 2023 - Meet Top Universities.,https://www.idp.com/nepal/australia-education-fair/,Great chance to directly meet Aus. universities and apply for the next intake. Scholarships...,not found,not found,media/data/scholarships in australia/scholarships in australia_3.png
scholarships in australia,Scholarship opportunity - Study abroad in Australia,https://www.newcastle.edu.au/scholarships/international-scholarships,"Study in Newcastle with more afforable cost of living compared to Sydney and Melbourne. Receive up to AUD$60,000 scholarship depending your course and length of study.",not found,not found,media/data/scholarships in australia/scholarships in australia_4.png
scholarships in australia,Find Out If You're Eligible - Explore Our Scholarships Today,https://scholarships.curtin.edu.au/,See If You Qualify For a Curtin Scholarship and Take the Next Step to Make Tomorrow Better,not found,not found,media/data/scholarships in australia/scholarships in australia_6.png
scholarships in australia,"Study in Sydney, Australia - Australia's No.1 Young Uni",https://utscollege.edu.au/au/future/articles/what-makes-sydney-a-top-study-destination,"Choose to study at UTS College, located in the heart of Sydney's vibrant city.",1800896994,[],media/data/scholarships in australia/scholarships in australia_7.png
plumber in sydney,Plumber Austral - Sydney's No.1 Plumbers On Call,https://fixnflow.com.au/,#1 Local Plumbing Specialists! 60 Minute* Response. Fixed Price Services. Book Online. Licensed & Certified Plumbers Providing Same Day* Burst Pipe Services....,not found,not found,media/data/plumber in sydney/plumber in sydney_24.png
plumber in sydney,"Blacktown Local Plumber - Blocked Drains, Plumber, Plumbing",https://blacktownlocalplumber.com.au/,From Hot Water Install To Servicing Blocked Drains. From Blocked Drains to hot water...,not found,not found,media/data/plumber in sydney/plumber in sydney_25.png
plumber in sydney,Plumber Sydney - #1 Local 24hr - Plumber Near You Now,https://plumbingservices.sydney/,"Open Now, we are an affordable plumber sydney team, 30yrs plumbing services Sydney Wide.",not found,not found,media/data/plumber in sydney/plumber in sydney_26.png
plumber in sydney,Our Services | Sydney Blocked Drain Group,https://sydneyblockeddraingroup.com.au/services/,Drainage Plumbers Providing Lasting Solutions So You Can Get Back To Your Day! Call Now. Ensure Your Drains Are Always Clear With Our Drainage...,not found,not found,media/data/plumber in sydney/plumber in sydney_29.png
plumber in sydney,Mr Splash Plumbing - Plumbing Sydney,https://www.mrsplashplumbing.com.au/,Keep Your Property Up To Date With Our Reliable Plumbers! Book Online & Receive 10% Off. Trusted 24/7 Plumbers Equipped With Latest Tech! 60 Min...,not found,not found,media/data/plumber in sydney/plumber in sydney_32.png
plumber in sydney,Plumber Prestons - Gas Leak? Get It Fixed ASAP,https://www.spsplumberseasternsuburbs.com.au/,"Broken Pipe? Be Charged Per Job, Not Per Hour With Our Local Plumbers! Request A Call Back. After Hours Plumbers Nearby To Help, Leaking Tap? Rely...",not found,not found,media/data/plumber in sydney/plumber in sydney_41.png
scholarships in australia,International Scholarships - The University of Canberra,https://www.canberra.edu.au/future-students/study-at-uc/international,Get Rewarded For Your Academic Performance. Set Yourself Up For a Global Future,not found,not found,media/data/scholarships in australia/scholarships in australia_11.png
plumber in sydney,Mr Splash Plumbing - Blocked Drains Cleared Fr $59*,https://www.plumbersonthego.com.au/,Trust The Experts! We're Trained For All Jet Blasting Services. Upfront Prices. Book Now,not found,not found,media/data/plumber in sydney/plumber in sydney_54.png
education scholarship in australia,Make A Difference - Financial Support Available,https://www.vic.gov.au/make-difference-early-childhood-teaching,Grab the opportunity to make a difference in the lives of children and their families. Make A...,1300161396,['Victorian Government'],media/data/education scholarship in australia/education scholarship in australia_2.png
electrician in america,"USA Electrical Jobs, Employment | Indeed.com",https://www.indeed.com/m/jobs?q=USA+Electrical,"On indeed.com there are thousands of jobs to find with one simple search! Apply to Electrician, Maintenance Technician, Maintenance Person and more. Easy Resume Upload.",not found,not found,media/data/electrician in america/electrician in america_0.png
electrician in america,Become an Electrician - Electrician School,https://ibt.edu/programs/electrician-training/,Prepare for the State of California Electrical Trainee (ET) certification. Take our...,not found,not found,media/data/electrician in america/electrician in america_1.png
electrician in america,"$50,000 to $68,000 Annually - Electrician Journeyman",https://gibsonelectrical.com/about-us/,"Friendly and Professional Work Environment. Electrical Troubleshooting, Problem Solving,",not found,not found,media/data/electrician in america/electrician in america_2.png
electrician in america,"Affordable Electrician - Dont worry , we will help you",https://ieaelectrician.com/,Professional Electricians Licensed in California and Working for over 32 Years. over 35...,not found,not found,media/data/electrician in america/electrician in america_3.png
scholarships in australia,Study in Western Australia - Prestigious Scholarships in WA,https://likenoother.wa.gov.au/study/,Be Future Career Ready with Cutting-Edge Programs & Access to Global Industry Connections,1103227153,[],media/data/scholarships in australia/scholarships in australia_19.png
plumber in sydney,Drains & Sewers Services in Sydney's North Shore | Killara...,https://www.killaraplumbing.com.au/plumbing-services/blocked-drains,"Get fixed price home plumbing services on Sydney's North Shore. Book a plumber now. Blocked drains, hot water, toilet repairs, pipe relining & more. Get in touch today!",not found,not found,media/data/plumber in sydney/plumber in sydney_64.png
electrician in canberra,CBR Electrical Contractors - Servicing Canberra & Surrounds,https://www.cbrelectricalcontractors.com.au/,"Electrical Specialist servicing Canberra and surrounding regions, Call Now for free quote! Get Your Electrical Work Expertly Completed by CBR Electrical Contractors. Get Directions.",0468554669,[],media/data/electrician in canberra/electrician in canberra_0.png
electrician in canberra,Canberra's Top Electricians - Canberra's Best Electricians,https://berkeleyelectrical.com.au/,"As Canberra's favourite local electricians, we offer knowledgeable service with a smile. Proud to serve Canberra's community. We care about the safety of your homes & businesses.",not found,not found,media/data/electrician in canberra/electrician in canberra_1.png
electrician in canberra,Certified Thermographer - Call Electrical Effect Today,https://www.electricaleffect.com.au/,Assure Your Business Against Electrical Faults. Book a Thermal Scan with Electrical Effect. Does Your Business Insurance Require a Thermal Scan of Your Switchboard? Let Us Help.,not found,not found,media/data/electrician in canberra/electrician in canberra_2.png
plumber in sydney,Plumber In Sydney - Honest & Upfront Pricing,https://www.willsonplumbers.com.au/,"There's No Job Too Hard for Our Experienced Team. We're Ready to Come and Help You Today. Emergency Plumbing, Hot Water, Blocked Drains, Leaking...",not found,not found,media/data/plumber in sydney/plumber in sydney_72.png
plumber in sydney,Same Day* Service Guarantee - $0* Call Out Fee. Book Now,https://akinproplumbing.com.au/,"24 Hour Trusted Gas Fitting Plumbers Same Day* Onsite Local Quotes, Request A Call Back",not found,not found,media/data/plumber in sydney/plumber in sydney_73.png
scholarships in newyork,Stony Brook University (SBU) - We Offer Generous Scholarships,https://www.stonybrook.edu/commcms/landing/scholarship-opportunities.php,Scholarships put top-tier education within your reach at New York’s #1 public university. Stand out with a world-class degree. We’ll help you find your place at SBU. Learn more.,not found,not found,media/data/scholarships in newyork/scholarships in newyork_0.png
scholarships in newyork,Study in New York - Find school in New York,https://americaeducators.com/,"Get Placement To One Of The Most High Ranking Schools In USA, Find schools in New York",not found,not found,media/data/scholarships in newyork/scholarships in newyork_1.png
scholarships in newyork,Fully Funded Fellowships - Browse Our Funded Programs,https://hertogfoundation.org/,Study the Fundamental Works of Political Philosophy with Leading Scholars. Engage In...,not found,not found,media/data/scholarships in newyork/scholarships in newyork_2.png
scholarships in newyork,Full Scholarships To Study Abroad - AFS-USA Scholarships,https://www.afsusa.org/study-abroad/scholarships/,Apply for full and partial merit-based scholarships for a variety of program destinations. AFS...,not found,not found,media/data/scholarships in newyork/scholarships in newyork_3.png
scholarships in newyork,Partial and Full Scholarships - Scholarships Available,https://www.brendansailing.org/scholarships.html,"We never turn down a child for financial reasons, apply for a student scholarship today! Building self-confidence with targeted instruction for youth with learning differences. LD Kids.",not found,not found,media/data/scholarships in newyork/scholarships in newyork_6.png
scholarships in newyork,"CUNY Master Degrees, NYC - Affordable Tuition",https://www.gc.cuny.edu/ma-info,The Graduate Center’s master's programs help students excel in a rapidly changing world.,not found,not found,media/data/scholarships in newyork/scholarships in newyork_7.png
scholarships in newyork,New York City Scholarships - Scholarship Opportunities,https://www.innercityscholarshipfund.org/scholarships/overview/,Our scholarship program gives kids the chance to attend a school they could not afford.,not found,not found,media/data/scholarships in newyork/scholarships in newyork_8.png
scholarships in newyork,Apply Now - In New York City,https://www.gc.cuny.edu/gc-info,"CUNY provides students with a top-quality, accessible education regardless of background.",not found,not found,media/data/scholarships in newyork/scholarships in newyork_10.png
plumber in sydney,Plumber Sydney CBD - Home - Dream Plumbing Pty Ltd,https://dreamplumbing.com.au/,Your Truly Local Neighbourhood Plumber! $0* Call Out Fee. Speedy Response Plumbing Team,not found,not found,media/data/plumber in sydney/plumber in sydney_8.png
"plumber Parramatta न्यू साउथ वेल्स, अष्ट्रेलिया","24 Hour, 7 Day Plumbers Sydney - Plumber Parramatta",https://cleanandclearplumbing.com.au/,5 Star Rated Plumbers Sydney! No Hidden Costs. $0* Call Out Fee. Request A...,not found,not found,"media/data/plumber Parramatta न्यू साउथ वेल्स, अष्ट्रेलिया/plumber Parramatta न्यू साउथ वेल्स, अष्ट्रेलिया_1.png"
plumber in sydney,Plumbers Sydney | Plumbing Services in Sydney,https://optimisedplumbingservices.com.au/,"Our friendly, reliable team have the experience and knowledge to fix your blocked drain. Using the latest technology, our fully licensed plumbers will unblock your drain fast.",not found,not found,media/data/plumber in sydney/plumber in sydney_12.png
furnitures in perth,Home | Muguet & Co - Muguet & Co,https://www.muguetandco.com.au/,Premium Quality Candles at Affordable Prices. Come in and Enjoy Our Selection. We Are Delighted To Inform You About Our Complimentary Gift Wrapping Service.,not found,not found,media/data/furnitures in perth/furnitures in perth_0.png
furnitures in perth,HS Furniture - Hs Furniture Design,https://www.hsfurniture.com.au/,"Uncompromising Quality And Natural Materials Inspire Mindful Living. Exquisite Furniture, Tailored To Your Space, Elevating Your Home.",not found,not found,media/data/furnitures in perth/furnitures in perth_1.png
furnitures in perth,Furniture Perth - Largest & Best Furniture Range,https://www.furniturebazaar.com.au/,"We offer one of the largest and best ranges of living, dining & bedroom furniture in Perth. For...",1654848652,"['Web Pixels', 'Web Pixels']",media/data/furnitures in perth/furnitures in perth_2.png
furnitures in perth,Shop Furniture At Myer - Stocktake Sale Is Now On,https://www.myer.com.au/c/home/all-furniture,"Shop Furniture At Myer, A Destination For Stylish Furniture & Quality Home Essentials. Shop Our Exclusive Stocktake Sale Duration Offers Online, Hurry While Stocks Last.",not found,not found,media/data/furnitures in perth/furnitures in perth_3.png
furnitures in perth,Affordable Prices - The Home of Furniture,https://www.amartfurniture.com.au/,"Amart Furniture Offers Year Round, Super-Easy Shopping Online or In-Store. Shop Amart...",not found,not found,media/data/furnitures in perth/furnitures in perth_4.png
furnitures in perth,Luxury Modern furniture - Luxury furniture Manufacturer.,http://www.sunweluxuryliving.com/products.php?id=288,"Each Luxury Villa, flats can highly customized to the owners taste and practical...",not found,not found,media/data/furnitures in perth/furnitures in perth_13.png
scholarships in sydney,Apply now for 2024 - Scholarships,https://www.queenwood.nsw.edu.au/Enrolment/Scholarships,"The student will be a very high academic achiever, with additional demonstrated strengths.",not found,not found,media/data/scholarships in sydney/scholarships in sydney_2.png
scholarship in america,Apply Online Today - Undergrad Programs,https://www.colostate.edu/,"CSU is committed to sustainability and are working to reduce our greenhouse gas emissions. At Colorado State, we observe and advance our world with curiosity and passion.",not found,not found,media/data/scholarship in america/scholarship in america_0.png
scholarship in america,Solutions - Scholarships Made Simple - Scholarship America,https://scholarshipamerica.org/partners/scholarship-solutions/,"We will customize a program to your needs, building in flexibility for the future. From...",1342177279,"['Scholarship Solutions', 'Scholarships Made', 'Scholarship America', 'Scholarship Solutions', 'Scholarship America', 'Providing Access', 'College Scholarships', 'Scholarship America', 'Scholarship America']",media/data/scholarship in america/scholarship in america_1.png
scholarship in america,Start Your Application Today - Get More Information Now,https://www.uccs.edu/journey/mba?utm_source=google&utm_medium=branded_mba&utm_campaign=uccs_fy23_cob-mba&utm_content=rsa,Get the prestige that comes with AACSB International accreditation at an affordable price.,not found,not found,media/data/scholarship in america/scholarship in america_2.png
scholarship in america,Saint Louis University - Start Your Application,https://www.slu.edu/admission/transfer/index.php,Looking for a seamless and affordable transition to a new college experience? Visit SLU!,not found,not found,media/data/scholarship in america/scholarship in america_3.png
scholarship in canada,Scholarships Study Canada Jobs 2023 | Indeed.com Canada,https://ca.indeed.com/q-scholarships-study-canada-jobs.html,"Thousands of Jobs added - find your perfect fit with one simple search! Whatever it is you're searching for, find it at Indeed.com. Find Jobs On-The-Go. Find Reviews and Salaries.",not found,not found,media/data/scholarship in canada/scholarship in canada_6.png
scholarship in canada,Full Scholarship To Study In Canada - Latest Results,https://www.discovertoday.co/ar?q=full%20scholarship%20to%20study%20in%20canada,Find Full Scholarship To Study In Canada. Now with us! Search For Full Scholarship To Study In Canada at Discovertoday.co. Schnelle Antwort. Suchergebnisse.,not found,not found,media/data/scholarship in canada/scholarship in canada_7.png
scholarship in canada,Apply Online & Get Started - Applications Open,https://www.4ccf.org/scholarships/,View dozens of local scholarship opportunities available for you through 4CCF. A charitable...,not found,not found,media/data/scholarship in canada/scholarship in canada_8.png
scholarship in canada,University of Tasmania - Scholarships Available,https://www.utas.edu.au/study/scholarships-fees-and-costs/international-scholarships,Choose from a wide range of courses that will help prepare you for a successful career,not found,not found,media/data/scholarship in canada/scholarship in canada_9.png
scholarship in canada,Scholarship In Canada - Explore the World Study Abroad,https://studyabroad.aeccglobal.com.np/study-in-canada-2023/?utm_source=Google&utm_details=Google_PPC&utm_campaign=20065688139&utm_content=154362708371&utm_term=,Get personalised counselling to study in Canada. Make informed decisions with confidence.,not found,not found,media/data/scholarship in canada/scholarship in canada_16.png
scholarship in canada,Apply for Scholarship In Canada - Book your free counselling,https://www.idp.com/nepal/md-education-fair/,"Scholarship In Canada discuss about Eligibility, Scholarships and post study work opportunities!",not found,not found,media/data/scholarship in canada/scholarship in canada_17.png
scholarship in canada,Affordable Canadian University - Now Accepting Applications,https://international.ufv.ca/study-in-canada/,Further your education at UFV. Over 70 programs available for international students.,not found,not found,media/data/scholarship in canada/scholarship in canada_22.png
scholarship in canada,Full scholarships in canada - Search Here,https://www.wefindanswers.co/ar?q=full%20scholarships%20in%20canada,Find Full scholarships in canada. Search Here Now. Search For Full scholarships in...,not found,not found,media/data/scholarship in canada/scholarship in canada_3.png
scholarship in canada,External Scholarship Opportunities,https://schulich.yorku.ca/student-life-services/financial-aid/external-opportunities/,Build for the Every Business. Earn Your Executive MBA from Canada's #1 Business School. External scholarship and award opportunities are updated on a regular basis. Read News.,416-736-5486,['Contact Directory'],media/data/scholarship in canada/scholarship in canada_4.png
scholarship in canada,Study In Canada Scholarships - Join Canada Admission Day,https://campaigns.aeccglobal.com.np/canada-virtual-fair-july-2023/?utm_source=Google&utm_details=Google_PPC&utm_campaign=20289673854&utm_content=149164168943&utm_term=study%20in%20canada,"Get free expert advice on universities, courses, scholarships etc, at Canada Admission Day",not found,not found,media/data/scholarship in canada/scholarship in canada_10.png
